[
  {
    "section": "publication",
    "name": "customer projection publishes the reviewed teacher guidance",
    "baseline": "scheduling",
    "patch": {
      "KB-ASMT-SCHEDULE.md": {
        "frontmatter": {
          "intentset.status": "approved",
          "intentset.reviewedBy": "team-assessment",
          "intentset.reviewedAt": "2026-09-30",
          "intentset.extensions": {
            "intentset.org/review": {
              "sources": {
                "BEH-ASMT-SCHEDULE": "@current",
                "RULE-ASMT-AUTH": "@current",
                "RULE-ASMT-FUTURE": "@current"
              }
            }
          },
          "intentset.tips": null
        }
      }
    },
    "request": {
      "visibility": "customer",
      "audience": "teacher",
      "product": "PRD-LANTERN",
      "release": "pilot-1",
      "role": "teacher",
      "edition": "standard",
      "flags": []
    },
    "valid": true,
    "published": {
      "ids": [
        "KB-ASMT-SCHEDULE"
      ],
      "mustNotContain": [
        "Schedule a student assessment",
        "Require a future release time",
        "Require assignment permission",
        "Student assessment assignment",
        "Keep backend access behind the slice seam",
        "Lantern example",
        "Prepare learning in advance",
        "Reduce assignment preparation friction",
        "Student assessment scheduling slice",
        "ScheduleAssessment contract",
        "Review student assessment scheduling behavior",
        "Accept an eligible schedule",
        "ADR-ASMT-SEAM.md",
        "BEH-ASMT-SCHEDULE.md",
        "CAP-ASMT-ASSIGN.md",
        "CONTRACT-ASMT-SCHEDULE.md",
        "INT-PREPARE.md",
        "OUT-PREPARE.md",
        "PRD-LANTERN.md",
        "RULE-ASMT-AUTH.md",
        "RULE-ASMT-FUTURE.md",
        "SCN-ASMT-SCHEDULE.md",
        "SLICE-ASMT-SCHEDULE.md",
        "TEST-ASMT-SCHEDULE.md",
        "BEH-ASMT-SCHEDULE",
        "RULE-ASMT-AUTH",
        "RULE-ASMT-FUTURE"
      ]
    },
    "notes": "Every explained source is internal, so the provenance counts three withheld sources and names none; the knowledge's own path is omitted below an internal projection. The tips are dropped here so the help file keys nothing and every internal ID can be listed as forbidden; the help cases below cover tips, whose keys are explained IDs by design (publication §5)."
  },
  {
    "section": "publication",
    "name": "An authorized internal projection publishes the same knowledge and may name its internal sources",
    "baseline": "scheduling",
    "patch": {
      "KB-ASMT-SCHEDULE.md": {
        "frontmatter": {
          "intentset.status": "approved",
          "intentset.reviewedBy": "team-assessment",
          "intentset.reviewedAt": "2026-09-30",
          "intentset.extensions": {
            "intentset.org/review": {
              "sources": {
                "BEH-ASMT-SCHEDULE": "@current",
                "RULE-ASMT-AUTH": "@current",
                "RULE-ASMT-FUTURE": "@current"
              }
            }
          }
        }
      }
    },
    "request": {
      "visibility": "internal",
      "audience": "teacher",
      "product": "PRD-LANTERN",
      "release": "pilot-1",
      "role": "teacher",
      "edition": "standard",
      "flags": [],
      "authorizedInternal": true
    },
    "valid": true,
    "published": {
      "ids": [
        "KB-ASMT-SCHEDULE"
      ]
    },
    "notes": "Internal projections need explicit authorization (Core §9); with it, the customer knowledge is still eligible, and withheld sources are no longer withheld."
  },
  {
    "section": "publication",
    "name": "PUB001 an internal projection with authorizedInternal false is refused",
    "baseline": "scheduling",
    "patch": {
      "KB-ASMT-SCHEDULE.md": {
        "frontmatter": {
          "intentset.status": "approved",
          "intentset.reviewedBy": "team-assessment",
          "intentset.reviewedAt": "2026-09-30",
          "intentset.extensions": {
            "intentset.org/review": {
              "sources": {
                "BEH-ASMT-SCHEDULE": "@current",
                "RULE-ASMT-AUTH": "@current",
                "RULE-ASMT-FUTURE": "@current"
              }
            }
          }
        }
      }
    },
    "request": {
      "visibility": "internal",
      "audience": "teacher",
      "product": "PRD-LANTERN",
      "release": "pilot-1",
      "role": "teacher",
      "edition": "standard",
      "flags": [],
      "authorizedInternal": false
    },
    "valid": false,
    "published": {
      "ids": []
    },
    "diagnostics": [
      "PUB001"
    ]
  },
  {
    "section": "publication",
    "name": "customer projection admits public knowledge",
    "baseline": "scheduling",
    "patch": {
      "KB-ASMT-SCHEDULE.md": {
        "frontmatter": {
          "intentset.status": "approved",
          "intentset.reviewedBy": "team-assessment",
          "intentset.reviewedAt": "2026-09-30",
          "intentset.extensions": {
            "intentset.org/review": {
              "sources": {
                "BEH-ASMT-SCHEDULE": "@current",
                "RULE-ASMT-AUTH": "@current",
                "RULE-ASMT-FUTURE": "@current"
              }
            }
          },
          "intentset.visibility": "public"
        }
      }
    },
    "request": {
      "visibility": "customer",
      "audience": "teacher",
      "product": "PRD-LANTERN",
      "release": "pilot-1",
      "role": "teacher",
      "edition": "standard",
      "flags": []
    },
    "valid": true,
    "published": {
      "ids": [
        "KB-ASMT-SCHEDULE"
      ]
    },
    "notes": "Customer projection allows public and customer records (Core §9)."
  },
  {
    "section": "publication",
    "name": "public projection excludes customer knowledge",
    "baseline": "scheduling",
    "patch": {
      "KB-ASMT-SCHEDULE.md": {
        "frontmatter": {
          "intentset.status": "approved",
          "intentset.reviewedBy": "team-assessment",
          "intentset.reviewedAt": "2026-09-30",
          "intentset.extensions": {
            "intentset.org/review": {
              "sources": {
                "BEH-ASMT-SCHEDULE": "@current",
                "RULE-ASMT-AUTH": "@current",
                "RULE-ASMT-FUTURE": "@current"
              }
            }
          }
        }
      }
    },
    "request": {
      "visibility": "public",
      "audience": "teacher",
      "product": "PRD-LANTERN",
      "release": "pilot-1",
      "role": "teacher",
      "edition": "standard",
      "flags": []
    },
    "valid": true,
    "published": {
      "ids": [],
      "mustNotContain": [
        "Prepare a scheduled student assessment",
        "Choose a published assessment"
      ]
    },
    "notes": "Not requested by ID, so it is excluded and counted, with no diagnostic."
  },
  {
    "section": "publication",
    "name": "public projection refuses customer knowledge requested by ID",
    "baseline": "scheduling",
    "patch": {
      "KB-ASMT-SCHEDULE.md": {
        "frontmatter": {
          "intentset.status": "approved",
          "intentset.reviewedBy": "team-assessment",
          "intentset.reviewedAt": "2026-09-30",
          "intentset.extensions": {
            "intentset.org/review": {
              "sources": {
                "BEH-ASMT-SCHEDULE": "@current",
                "RULE-ASMT-AUTH": "@current",
                "RULE-ASMT-FUTURE": "@current"
              }
            }
          }
        }
      }
    },
    "request": {
      "visibility": "public",
      "audience": "teacher",
      "product": "PRD-LANTERN",
      "release": "pilot-1",
      "role": "teacher",
      "edition": "standard",
      "flags": [],
      "ids": [
        "KB-ASMT-SCHEDULE"
      ]
    },
    "valid": false,
    "diagnostics": [
      "CORE008"
    ],
    "published": {
      "ids": [],
      "mustNotContain": [
        "Prepare a scheduled student assessment",
        "Choose a published assessment",
        "KB-ASMT-SCHEDULE.md"
      ]
    },
    "notes": "The refusal names the ID only: the same message an unknown ID gets, with no path."
  },
  {
    "section": "publication",
    "name": "P01 draft customer knowledge selected for publication",
    "baseline": "scheduling",
    "request": {
      "visibility": "customer",
      "audience": "teacher",
      "product": "PRD-LANTERN",
      "release": "pilot-1",
      "role": "teacher",
      "edition": "standard",
      "flags": [],
      "ids": [
        "KB-ASMT-SCHEDULE"
      ]
    },
    "valid": false,
    "diagnostics": [
      "CORE008"
    ],
    "published": {
      "ids": [],
      "mustNotContain": [
        "Choose a published assessment"
      ]
    },
    "patch": {
      "KB-ASMT-SCHEDULE.md": {
        "frontmatter": {
          "intentset.status": "draft"
        }
      }
    },
    "notes": "The baseline's knowledge is approved since 2026-10-11, so the case demotes it."
  },
  {
    "section": "publication",
    "name": "P01 draft knowledge is excluded when not requested",
    "baseline": "scheduling",
    "request": {
      "visibility": "customer",
      "audience": "teacher",
      "product": "PRD-LANTERN",
      "release": "pilot-1",
      "role": "teacher",
      "edition": "standard",
      "flags": []
    },
    "valid": true,
    "published": {
      "ids": [],
      "mustNotContain": [
        "Choose a published assessment"
      ]
    },
    "notes": "Boundary: deny by default needs no diagnostic to keep a draft out. The baseline's knowledge is approved since 2026-10-11, so the case demotes it.",
    "patch": {
      "KB-ASMT-SCHEDULE.md": {
        "frontmatter": {
          "intentset.status": "draft"
        }
      }
    }
  },
  {
    "section": "publication",
    "name": "P02 public knowledge links an internal decision",
    "baseline": "scheduling",
    "patch": {
      "KB-ASMT-SCHEDULE.md": {
        "frontmatter": {